region,comuna,titulo,fecha,bajada,link,medio,label,score
Los Lagos,San Pablo,"Lake Titicaca, the Sewer of Puno (Spanish)",2023-08-21,"All the rivers that flow into Lake Titicaca are contaminated with heavy metals, fecal waste, and garbage, a situation that has had negative",https://pulitzercenter.org/es/stories/lake-titicaca-sewer-puno-spanish,Pulitzer Center,conflicto minero,0.4947240054607391
Los Lagos,San Pablo,Los desechos mineros que contaminan los ríos en Cusco,2023-10-21,"Pese a la gran actividad minera, que data desde antes del imperio incaico, en Cusco hay apenas 240 desechos mineros registrados y que",https://convoca.pe/investigacion/los-desechos-mineros-que-contaminan-los-rios-en-cusco,Convoca,conflicto minero,0.812076985836029
Aisén del Gral. Carlos Ibáñez del Campo,Cisnes,Aysén: SMA formula cargo gravísimo a empresa Multi X por sobreproducción en CES Cholga,2024-07-21,"Lo anterior, ya que durante cinco ciclos productivos registrados entre los años 2014 y 2023, y donde se habría generado excesos de",https://portal.sma.gob.cl/index.php/aysen-sma-formula-cargo-gravisimo-a-empresa-multi-x-por-sobreproduccion-en-ces-cholga/,Superintendencia Del Medio Ambiente – Gobierno de Chile,conflicto minero,0.4346657991409302
Aisén del Gral. Carlos Ibáñez del Campo,Guaitecas,Aysén: SMA formula cargo gravísimo a empresa Multi X por sobreproducción en CES Cholga,2024-07-21,"Lo anterior, ya que durante cinco ciclos productivos registrados entre los años 2014 y 2023, y donde se habría generado excesos de",https://portal.sma.gob.cl/index.php/aysen-sma-formula-cargo-gravisimo-a-empresa-multi-x-por-sobreproduccion-en-ces-cholga/,Superintendencia Del Medio Ambiente – Gobierno de Chile,conflicto minero,0.4346657991409302
Magallanes y de la Antártica Chilena,Río Verde,Argentina reinicia la minería de cobre en medio de tensiones ambientales | Inter Press Service,2024-07-21,"La cordillera de los Andes es una de las regiones con mayor concentración de depósitos minerales del mundo, abarcando el sur de Perú,",https://www.ovejeronoticias.cl/2024/07/argentina-reinicia-la-mineria-de-cobre-en-medio-de-tensiones-ambientales-inter-press-service/,OvejeroNoticias,conflicto minero,0.8574081659317017
Arica y Parinacota,Camarones,SMA ordena Medidas Urgentes y Transitorias a la empresa Engie Energía Chile por proyecto en Arica,2024-07-11,"Esto, por efectos no previstos en la evaluación ambiental del proyecto subestación seccionadora Roncacho. Lo anterior, tras la aparición de",https://portal.sma.gob.cl/index.php/sma-ordena-medidas-urgentes-y-transitorias-a-la-empresa-engie-energia-chile-por-proyecto-en-arica/,Superintendencia Del Medio Ambiente – Gobierno de Chile,conflicto energias renovables,0.4742957949638366
Arica y Parinacota,Putre,ARICA: TRABAJADORES DE QUIBORAX PREOCUPADOS POR POSIBLE CIERRE DE LA EMPRESA MIENTRAS DURA JUICIO INTERPUESTO POR EVENTUAL DAÑO AL SALAR DE SURIRE,2024-08-22,"De acuerdo con la información consignada por Soy Arica, decenas de trabajadores de la empresa Quiborax marcharon por el centro de la ciudad",https://vilasradio.cl/arica-trabajadores-de-quiborax-preocupados-por-posible-cierre-de-la-empresa-mientras-dura-juicio-interpuesto-por-eventual-dano-al-salar-de-surire/,Vilas Radio,conflicto energias renovables,0.3498457670211792
Tarapacá,Pozo Almonte,Tarapacá y Antofagasta: AES Andes ingresa a SEA nuevo proyecto renovable y alcanza los US$3.000 millones en tramitación de parques fotovoltaicos con almacenamiento de baterías,2024-09-06,"En su conjunto, contemplan una capacidad instalada de más de 1.700 MW fotovoltaicos y 2.000 MW de baterías para optimizar el uso de energías",https://g5noticias.cl/2024/09/06/tarapaca-y-antofagasta-aes-andes-ingresa-a-sea-nuevo-proyecto-renovable-y-alcanza-los-us3-000-millones-en-tramitacion-de-parques-fotovoltaicos-con-almacenamiento-de-baterias/,G5noticias,conflicto energias renovables,0.5197910666465759
Antofagasta,Antofagasta,Diputado Jaime Araya: “Ministerio de Medio Ambiente no ha cumplido con los conflictos socioambientales abiertos en Antofagasta y Calama”,2023-11-20,MMA sufrió un duro golpe en la Cámara de Diputados al rechazarse la partida completa de financiamiento para el 2024.hace 12 meses,https://www.soychile.cl/antofagasta/sociedad/2023/11/17/836074/jaime.html,SoyChile.cl,conflicto energias renovables,0.4853999316692352
Antofagasta,Calama,Diputado Jaime Araya: “Ministerio de Medio Ambiente no ha cumplido con los conflictos socioambientales abiertos en Antofagasta y Calama”,2023-11-20,MMA sufrió un duro golpe en la Cámara de Diputados al rechazarse la partida completa de financiamiento para el 2024.hace 12 meses,https://www.soychile.cl/antofagasta/sociedad/2023/11/17/836074/jaime.html,SoyChile.cl,conflicto energias renovables,0.4853999316692352
Antofagasta,Calama,TIERRA AMARILLA: LA “ZONA DE SACRIFICIO” OLVIDADA,2021-07-21,Por Jorge Oporto Marín (Periodista – Guía de Turismo). En Chile se acuñó un término que la mayoría de las personas no le confiere mayor,https://tierramarillano.cl/2021/07/21/tierra-amarilla-la-zona-de-sacrificio-olvidada/,Tierramarillano,conflicto energias renovables,0.5394449234008789
Antofagasta,Mejillones,Mejillones: Corte Suprema ordena revisar calificación ambiental de termoeléctrica Angamos,2022-04-21,La sentencia acoge la apelación presentada por vecinos y vecinas de Mejillones y mandata al Servicio de Evaluación Ambiental a incorporar,https://www.fima.cl/2022/04/21/mejillones-corte-suprema-ordena-revisar-calificacion-ambiental-de-termoelectrica-angamos/,ONG Fima,conflicto energias renovables,0.4547959864139557
Antofagasta,Mejillones,Plan de descarbonización y reconversión de termoeléctricas: el conflicto que saca chispas,2024-08-05,"En el contexto del Plan de Descarbonización que será publicado en septiembre, se establecerán acciones orientadas a que el Servicio de",https://www.terram.cl/plan-de-descarbonizacion-y-reconversion-de-termoelectricas-el-conflicto-que-saca-chispas/,Fundación Terram,conflicto energias renovables,0.4741041958332062
Antofagasta,Mejillones,TIERRA AMARILLA: LA “ZONA DE SACRIFICIO” OLVIDADA,2021-07-21,Por Jorge Oporto Marín (Periodista – Guía de Turismo). En Chile se acuñó un término que la mayoría de las personas no le confiere mayor,https://tierramarillano.cl/2021/07/21/tierra-amarilla-la-zona-de-sacrificio-olvidada/,Tierramarillano,conflicto energias renovables,0.5394449234008789
Antofagasta,San Pedro de Atacama,Diputado Jaime Araya: “Ministerio de Medio Ambiente no ha cumplido con los conflictos socioambientales abiertos en Antofagasta y Calama”,2023-11-20,MMA sufrió un duro golpe en la Cámara de Diputados al rechazarse la partida completa de financiamiento para el 2024.hace 12 meses,https://www.soychile.cl/antofagasta/sociedad/2023/11/17/836074/jaime.html,SoyChile.cl,conflicto energias renovables,0.4853999316692352
Antofagasta,San Pedro de Atacama,Más carbón al aire en Mejillones: La firma francesa Engie inaugura nueva central termoeléctrica en la región de Antofagasta,2019-05-31,"La empresa francesa Engie comenzó con las operaciones de la termoeléctrica Infraestructura Energética Mejillones (EIM), que se comenzó a",https://www.diarioantofagasta.cl/regional/mejillones/104777/mas-carbon-al-aire-en-mejillones-la-firma-francesa-engie-inaugura-nueva-central-termoelectrica-en-la-region-de-antofagasta/,El Diario de Antofagasta,conflicto energias renovables,0.6549109816551208
Antofagasta,Sierra Gorda,Amparo Cornejo asume Vicepresidencia de Sustentabilidad y Asuntos Corporativos de Teck Chile,2018-12-21,"Skip to end of metadata Page restrictions apply Attachments:2 Added by Editor Portal Minero, last edited by Editor Portal Minero on dic 21,",http://www.portalminero.com/display/NOT/2018/12/21/Amparo%2BCornejo%2Basume%2BVicepresidencia%2Bde%2BSustentabilidad%2By%2BAsuntos%2BCorporativos%2Bde%2BTeck%2BChile,Portal Minero,conflicto energias renovables,0.4968672096729278
Antofagasta,Taltal,"CEO de Colbún y rechazo a millonario proyecto de energía renovable en Taltal: ""Vemos una tremenda disparidad en criterios de evaluación""",2024-09-29,José Ignacio Escobar dijo que no creía que existe un sesgo en el rechazo del Servicio de Evaluación Ambiental (SEA) de Antofagasta a la,https://www.t13.cl/noticia/negocios/ceo-colbun-rechazo-millonario-proyecto-energia-renovable-taltal-vemos-una-treme-29-9-2024,T13,conflicto energias renovables,0.968813180923462
Antofagasta,Tocopilla,Plan de descarbonización y reconversión de termoeléctricas: el conflicto que saca chispas,2024-08-05,"En el contexto del Plan de Descarbonización que será publicado en septiembre, se establecerán acciones orientadas a que el Servicio de",https://www.terram.cl/plan-de-descarbonizacion-y-reconversion-de-termoelectricas-el-conflicto-que-saca-chispas/,Fundación Terram,conflicto energias renovables,0.4741041958332062
Antofagasta,Tocopilla,Hidrógeno… ¿verde?,2021-11-22,"El hidrógeno tuvo un marcado protagonismo en la reciente COP26. Diversos paneles resaltaron el potencial de esta industria,",https://www.ciperchile.cl/2021/11/22/hidrogeno-verde/,- CIPER Chile,conflicto energias renovables,0.4965870082378387
Antofagasta,Tocopilla,TIERRA AMARILLA: LA “ZONA DE SACRIFICIO” OLVIDADA,2021-07-21,Por Jorge Oporto Marín (Periodista – Guía de Turismo). En Chile se acuñó un término que la mayoría de las personas no le confiere mayor,https://tierramarillano.cl/2021/07/21/tierra-amarilla-la-zona-de-sacrificio-olvidada/,Tierramarillano,conflicto energias renovables,0.5394449234008789
Atacama,Caldera,DIMAO REALIZÓ LA PRIMERA FERIA MEDIOAMBIENTAL EN CALDERA,2022-06-15,"En el contexto de la celebración del mes del Medioambiente, la Dirección de Medio Ambiente, Aseo y Ornato (DIMAO) de la Municipalidad de",https://tierramarillano.cl/2022/06/15/dimao-realizo-la-primera-feria-medioambiental-en-caldera/,Tierramarillano,conflicto energias renovables,0.6199736595153809
Atacama,Chañaral,Industria Eólica financiará estudio para asegurar el futuro hídrico de Carrizalillo y Chañaral de Aceituno,2018-09-07,Industria Eólica financiará estudio para asegurar el futuro hídrico de Carrizalillo y Chañaral de Aceituno | Ministerio de Energía.hace 74 meses,https://energia.gob.cl/noticias/atacama/industria-eolica-financiara-estudio-para-asegurar-el-futuro-hidrico-de-carrizalillo-y-chanaral-de-aceituno,Ministerio de Energía |,conflicto energias renovables,0.4534182846546173
Atacama,Chañaral,DECISIÓN ERRADA ANUNCIADA EN EL ÚLTIMO ENCUENTRO CHILENO ARGENTINO ATACALAR 2024,2024-04-14,Decisión afectará negativamente la economía regional. Por Ulises Carabantes Ahumada – Ingeniero Civil Industrial.hace 7 meses,https://tierramarillano.cl/2024/04/14/decision-errada-anunciada-en-el-ultimo-encuentro-chileno-argentino-atacalar-2024/,Tierramarillano,conflicto energias renovables,0.4358037412166595
Atacama,Copiapó,TIERRA AMARILLA: LA “ZONA DE SACRIFICIO” OLVIDADA,2021-07-21,Por Jorge Oporto Marín (Periodista – Guía de Turismo). En Chile se acuñó un término que la mayoría de las personas no le confiere mayor,https://tierramarillano.cl/2021/07/21/tierra-amarilla-la-zona-de-sacrificio-olvidada/,Tierramarillano,conflicto energias renovables,0.5394449234008789
Atacama,Copiapó,Pacific Hydro reingresa proyecto para construir parque fotovoltaico en Copiapó con inversión de US$375 millones,2023-07-18,"Inicialmente, la inversión para el parque Solar Wing era de US$170 millones, pero ahora más que se duplicó tras ser devuelta para la",https://www.latercera.com/earlyaccess/noticia/pacific-hydro-reingresa-proyecto-para-construir-parque-fotovoltaico-en-copiapo-con-inversion-de-us375-millones/ISVAQVLORFGHPBXYN2FRNUVB3E/,La Tercera,conflicto energias renovables,0.5213655233383179
Atacama,Copiapó,Cuando el ministro Paris apoyó un proyecto termoeléctrico que amenazaba la salud y el ambiente local,2020-07-07,Por Valentina Luza / resumen.cl Uno de los proyectos más polémicos del negocio de los combustibles fósiles de la última,https://resumen.cl/articulos/cuando-el-ministro-paris-apoyo-un-proyecto-termoelectrico-que-amenazaba-la-salud-y-el-ambiente-local,Resumen.cl,conflicto energias renovables,0.5781760811805725
Atacama,Copiapó,Cuando el ministro Paris apoyó un proyecto termoeléctrico que amenazaba la salud y el ambiente local,2020-07-07,Por Valentina Luza / resumen.cl Uno de los proyectos más polémicos del negocio de los combustibles fósiles de la última,https://resumen.cl/articulos/cuando-el-ministro-paris-apoyo-un-proyecto-termoelectrico-que-amenazaba-la-salud-y-el-ambiente-local,Resumen.cl,conflicto energias renovables,0.5781760811805725
Atacama,Diego de Almagro,TIERRA AMARILLA: LA “ZONA DE SACRIFICIO” OLVIDADA,2021-07-21,Por Jorge Oporto Marín (Periodista – Guía de Turismo). En Chile se acuñó un término que la mayoría de las personas no le confiere mayor,https://tierramarillano.cl/2021/07/21/tierra-amarilla-la-zona-de-sacrificio-olvidada/,Tierramarillano,conflicto energias renovables,0.5394449234008789
Atacama,Huasco,"Las termoeléctricas en Huasco han generado un «círculo vicioso entre la relación empresa-poblado, donde las empresas van a satisfacer necesidades que el Estado no cumple», afirma defensor ambiental",2024-06-18,"Ladislao Palma reveló a #FuturoPQN que ""este grupo no tiene ninguna intención de cerrarlas, sino de hacer negocios con su nueva inversión"".hace 5 meses",https://www.futuro.cl/2024/06/las-termoelectricas-en-huasco-han-generado-un-circulo-vicioso-entre-la-relacion-empresa-poblado-donde-las-empresas-van-a-satisfacer-necesidades-que-el-estado-no-cumple-afirma-defensor-ambiental/,Futuro Chile,conflicto energias renovables,0.8202975392341614
Atacama,Huasco,Plan de descarbonización y reconversión de termoeléctricas: el conflicto que saca chispas,2024-08-05,"En el contexto del Plan de Descarbonización que será publicado en septiembre, se establecerán acciones orientadas a que el Servicio de",https://www.terram.cl/plan-de-descarbonizacion-y-reconversion-de-termoelectricas-el-conflicto-que-saca-chispas/,Fundación Terram,conflicto energias renovables,0.4741041958332062
Atacama,Huasco,TIERRA AMARILLA: LA “ZONA DE SACRIFICIO” OLVIDADA,2021-07-21,Por Jorge Oporto Marín (Periodista – Guía de Turismo). En Chile se acuñó un término que la mayoría de las personas no le confiere mayor,https://tierramarillano.cl/2021/07/21/tierra-amarilla-la-zona-de-sacrificio-olvidada/,Tierramarillano,conflicto energias renovables,0.5394449234008789
Atacama,Tierra Amarilla,TIERRA AMARILLA: LA “ZONA DE SACRIFICIO” OLVIDADA,2021-07-21,Por Jorge Oporto Marín (Periodista – Guía de Turismo). En Chile se acuñó un término que la mayoría de las personas no le confiere mayor,https://tierramarillano.cl/2021/07/21/tierra-amarilla-la-zona-de-sacrificio-olvidada/,Tierramarillano,conflicto energias renovables,0.5394449234008789
Atacama,Tierra Amarilla,Pacific Hydro reingresa proyecto para construir parque fotovoltaico en Copiapó con inversión de US$375 millones,2023-07-18,"Inicialmente, la inversión para el parque Solar Wing era de US$170 millones, pero ahora más que se duplicó tras ser devuelta para la",https://www.latercera.com/earlyaccess/noticia/pacific-hydro-reingresa-proyecto-para-construir-parque-fotovoltaico-en-copiapo-con-inversion-de-us375-millones/ISVAQVLORFGHPBXYN2FRNUVB3E/,La Tercera,conflicto energias renovables,0.5213655233383179
Atacama,Tierra Amarilla,Superintendencia de Medio Ambiente formula cargos contra planta de Compañía Minera del Pacífico,2023-06-09,La empresa arriesga multas de hasta seis mil UTM por dos infracciones en la Planta Metalúrgica Magnetita. Esta última se encuentra en la,https://radio.uchile.cl/2023/06/09/superintendencia-de-medio-ambiente-formula-cargos-contra-planta-de-compania-minera-del-pacifico/,Radio Universidad de Chile,conflicto energias renovables,0.4313916862010956
Atacama,Vallenar,"Las termoeléctricas en Huasco han generado un «círculo vicioso entre la relación empresa-poblado, donde las empresas van a satisfacer necesidades que el Estado no cumple», afirma defensor ambiental",2024-06-18,"Ladislao Palma reveló a #FuturoPQN que ""este grupo no tiene ninguna intención de cerrarlas, sino de hacer negocios con su nueva inversión"".hace 5 meses",https://www.futuro.cl/2024/06/las-termoelectricas-en-huasco-han-generado-un-circulo-vicioso-entre-la-relacion-empresa-poblado-donde-las-empresas-van-a-satisfacer-necesidades-que-el-estado-no-cumple-afirma-defensor-ambiental/,Futuro Chile,conflicto energias renovables,0.8202975392341614
Coquimbo,Combarbalá,Preocupación en Combarbalá por proyecto para una termoeléctrica a petróleo,2016-03-04,Según diario electrónico de esa ciudad (El Combarlito) el proyecto fue “camuflado” con el nombre de “Proyecto central de respaldo Combarbalá,https://ovallehoy.cl/preocupacion-en-combarbala-por-proyecto-para-una-termoelectrica-a-petroleo/,Ovalle Hoy,conflicto energias renovables,0.7879325747489929
Coquimbo,Coquimbo,Declaran situación de Emergencia Climática y Medioambiental para la Región de Coquimbo,2021-08-23,"El anuncio de la gobernadora Krist Naranjo responde a los efectos del cambio climático sobre la zona, como la sequía prolongada por más de",https://radio.uchile.cl/2021/08/23/declaran-situacion-de-emergencia-climatica-y-medioambiental-para-la-region-de-coquimbo/,Radio Universidad de Chile,conflicto energias renovables,0.6827983856201172
Coquimbo,Coquimbo,La caída de la termoeléctrica Barrancones: la primera medida «ambiental» en Piñera I que buscaba favorecer a minera Dominga,2021-10-04,"En 2010, el Mandatario se veía enfrentado al primer conflicto medioambiental de su Gobierno, con decenas de manifestantes enfilando con",https://www.elmostrador.cl/noticias/pais/2021/10/04/la-caida-de-la-termoelectrica-barrancones-la-primera-medida-ambiental-en-pinera-i-que-buscaba-favorecer-a-minera-dominga/,El Mostrador,conflicto energias renovables,0.6386545896530151
Coquimbo,La Higuera,Declaran situación de Emergencia Climática y Medioambiental para la Región de Coquimbo,2021-08-23,"El anuncio de la gobernadora Krist Naranjo responde a los efectos del cambio climático sobre la zona, como la sequía prolongada por más de",https://radio.uchile.cl/2021/08/23/declaran-situacion-de-emergencia-climatica-y-medioambiental-para-la-region-de-coquimbo/,Radio Universidad de Chile,conflicto energias renovables,0.6827983856201172
Coquimbo,La Serena,Declaran situación de Emergencia Climática y Medioambiental para la Región de Coquimbo,2021-08-23,"El anuncio de la gobernadora Krist Naranjo responde a los efectos del cambio climático sobre la zona, como la sequía prolongada por más de",https://radio.uchile.cl/2021/08/23/declaran-situacion-de-emergencia-climatica-y-medioambiental-para-la-region-de-coquimbo/,Radio Universidad de Chile,conflicto energias renovables,0.6827983856201172
Coquimbo,Ovalle,Las repercusiones de un parque eólico en Ovalle: nueve cóndores ya han muerto por colisión,2024-05-07,El ave nacional ya no vuela con majestuosidad y de forma tranquila en Chile. Lo anterior quedó demostrado tras la revisión que hizo la Red,https://laderasur.com/articulo/las-repercusiones-de-un-parque-eolico-en-ovalle-nueve-condores-ya-han-muerto-por-colision/,Ladera Sur,conflicto energias renovables,0.4730431139469147
Coquimbo,Ovalle,Preocupación en Combarbalá por proyecto para una termoeléctrica a petróleo,2016-03-04,Según diario electrónico de esa ciudad (El Combarlito) el proyecto fue “camuflado” con el nombre de “Proyecto central de respaldo Combarbalá,https://ovallehoy.cl/preocupacion-en-combarbala-por-proyecto-para-una-termoelectrica-a-petroleo/,Ovalle Hoy,conflicto energias renovables,0.7879325747489929
Valparaíso,Casablanca,Proyecto de parque solar en Valparaíso por US $125 millones queda en suspenso por permisología,2024-07-21,"Alrededor de las 17:00 de este miércoles, la Comisión de Evaluación Ambiental (COEVA) de Valparaíso resolvió no aprobar la iniciativa",https://www.ex-ante.cl/permisologia-proyecto-de-parque-solar-en-valparaiso-por-us-125-millones-es-rechazado/,Ex-Ante,conflicto energias renovables,0.4292008876800537
Valparaíso,Casablanca,Proyecto de parque solar en Valparaíso por US$ 125 millones queda en suspenso por permisología,2024-07-21,"Este miércoles será un día clave para el proyecto “Parque Solar Alicanto”, de US$ 125 millones, que está planificado para realizarse en la",https://www.ex-ante.cl/proyecto-de-parque-solar-en-valparaiso-por-us-125-millones-queda-en-suspenso-por-permisologia/,Ex-Ante,conflicto energias renovables,0.4292008876800537
Valparaíso,Concón,"SMA multa a ENAP Refinerías por incumplimientos al Plan de Prevención y Descontaminación Atmosférica de Concón, Quintero y Puchuncaví",2024-07-05,"Esto, luego de que constatara una superación al límite permitido de emisión de material particulado y de dióxido de azufre (SO₂) en el",https://portal.sma.gob.cl/index.php/sma-multa-a-enap-refinerias-por-incumplimientos-al-plan-de-prevencion-y-descontaminacion-atmosferica-de-concon-quintero-y-puchuncavi/,Superintendencia Del Medio Ambiente – Gobierno de Chile,conflicto energias renovables,0.5610160827636719
Valparaíso,El Quisco,“¿Qué pasa si no se suelta el agua?”: Greenpeace recreó icónicos lugares urbanos sin agua con el fin de graficar la crisis hídrica,2021-04-09,Greenpeace realizó una intervención digital en cuatro ciudades de Chile para graficar cómo lucirían algunos íconos urbanos si la escasez,https://www.greenpeace.org/chile/noticia/uncategorized/que-pasa-si-no-se-suelta-el-agua-greenpeace-recreo-iconicos-lugares-urbanos-sin-agua-con-el-fin-de-graficar-la-crisis-hidrica/,Greenpeace,conflicto energias renovables,0.4693947434425354
Valparaíso,El Tabo,La batalla de los Matetic contra el Estado por un Santuario de la Naturaleza,2024-05-22,La familia heredera de Inchalam y la viña homónima objetó el mes pasado ante la justicia ambiental la decisión del Ministerio de Medio,https://www.latercera.com/pulso-pm/noticia/la-batalla-de-los-matetic-contra-el-estado-por-un-santuario-de-la-naturaleza/SJVN75UEGNEEXCL4H4Z3ECAR7U/,La Tercera,conflicto energias renovables,0.390523225069046
Valparaíso,El Tabo,“¿Qué pasa si no se suelta el agua?”: Greenpeace recreó icónicos lugares urbanos sin agua con el fin de graficar la crisis hídrica,2021-04-09,Greenpeace realizó una intervención digital en cuatro ciudades de Chile para graficar cómo lucirían algunos íconos urbanos si la escasez,https://www.greenpeace.org/chile/noticia/uncategorized/que-pasa-si-no-se-suelta-el-agua-greenpeace-recreo-iconicos-lugares-urbanos-sin-agua-con-el-fin-de-graficar-la-crisis-hidrica/,Greenpeace,conflicto energias renovables,0.4693947434425354
Valparaíso,Isla de Pascua,“¿Qué pasa si no se suelta el agua?”: Greenpeace recreó icónicos lugares urbanos sin agua con el fin de graficar la crisis hídrica,2021-04-09,Greenpeace realizó una intervención digital en cuatro ciudades de Chile para graficar cómo lucirían algunos íconos urbanos si la escasez,https://www.greenpeace.org/chile/noticia/uncategorized/que-pasa-si-no-se-suelta-el-agua-greenpeace-recreo-iconicos-lugares-urbanos-sin-agua-con-el-fin-de-graficar-la-crisis-hidrica/,Greenpeace,conflicto energias renovables,0.4693947434425354
Valparaíso,Juan Fernández,“¿Qué pasa si no se suelta el agua?”: Greenpeace recreó icónicos lugares urbanos sin agua con el fin de graficar la crisis hídrica,2021-04-09,Greenpeace realizó una intervención digital en cuatro ciudades de Chile para graficar cómo lucirían algunos íconos urbanos si la escasez,https://www.greenpeace.org/chile/noticia/uncategorized/que-pasa-si-no-se-suelta-el-agua-greenpeace-recreo-iconicos-lugares-urbanos-sin-agua-con-el-fin-de-graficar-la-crisis-hidrica/,Greenpeace,conflicto energias renovables,0.4693947434425354
Valparaíso,La Ligua,Estudiantes y comunidad de Villa Alemana conocieron maqueta Enercity,2018-10-29,"Iniciativa del Ministerio de Energía que busca dar a conocer el funcionamiento del sector energético a la ciudadanía. ,. 29 octubre 2018.56 個月前",https://energia.gob.cl/noticias/valparaiso/estudiantes-y-comunidad-de-villa-alemana-conocieron-maqueta-enercity,Ministerio de Energía |,conflicto energias renovables,0.5342599153518677
Valparaíso,Limache,Los cuatro municipios de la provincia de Marga Marga y el gobernador Mundaca se unen contra termoeléctrica Los Rulos,2021-09-16,"Medio Ambiente / Alcaldes y alcaldesas de Limache, Quilpué, Villa Alemana y Olmué, más la máxima autoridad regional y organizaciones",https://www.paiscircular.cl/medio-ambiente/los-cuatro-municipios-de-la-provincia-de-marga-marga-y-el-gobernador-mundaca-se-unen-contra-termoelectrica-los-rulos/,País Circular,conflicto energias renovables,0.4603250920772552
Valparaíso,Limache,Batalla judicial por termoeléctrica Los Rulos: Comunidad de Limache se opone a su emplazamiento,2022-07-28,"Hasta el Tribunal Medio Ambiental llegó el alcalde Limache, Daniel Morales, a presentar un recurso de invalidación para que no se construya",https://www.futuro360.com/desafiotierra/batalla-judicial-termoelectrica-los-rulos_20220728/,#FUTURO360,conflicto energias renovables,0.5259250998497009
Valparaíso,Limache,Las mentiras de Aguas Pacifico y las consecuencias del proyecto en la región de Valparaíso,2023-07-21,"Esto lo dicen mientras intentan cooptar a organizaciones sociales de la comuna, como fue denunciado por la federación de pescadores,",https://www.laizquierdadiario.cl/Las-mentiras-de-Aguas-Pacifico-y-las-consecuencias-del-proyecto-en-la-region-de-Valparaiso,La Izquierda Diario Chile,conflicto energias renovables,0.6545639634132385
